id,date,user,pc,url,content
{V1Y4-S2IR20QU-6154HFXJ},01/02/2010 06:55:16,LRR0148,PC-4275,http://msn.com/The_Human_Centipede_First_Sequence/katsuro/arjf309875127.htm,remain representatives consensus concert although connect component collaborated mind sea 200 decision mixture regarding days warners rich fifth 1991 return 1988 apologized united crew tension particular allied rhythm making japanese enhance pop myself whole allmusic bras at focused throughout another touches want references
{Q5R1-T3EF87UE-2395RWZS},01/02/2010 07:00:13,NGF0157,PC-6056,http://urbanspoon.com/Plunketts_Creek_Loyalsock_Creek/loyalsock/ivqrbtnzrferprvivatpbbxvatfnsrgltbfcryzhfvp69774532.jsp,festival off northwards than congestion partnership married 1830 acquired gentleman closely 17 take 1841 hundreds indicated allowing order characters disjunct hub temperature examples expanded adapted tribute
{X9O1-O0XW52VO-5806RPHG},01/02/2010 07:03:46,NGF0157,PC-6056,http://aa.com/Rhodocene/rhodocenium/fhaavatqrfxgbcrkrphgvir1766627142.html,long away reorganized baldwin seth business 1888 while trail auction took joseph legislative prohibiting 4000 within heirs incorporated commerce years five length accepted researchers relatively del rearing authorities secondary energetic walls single
{G5S8-U5OG04TE-5299CCTU},01/02/2010 07:05:26,IRM0931,PC-7188,http://groupon.com/Leonhard_Euler/leonhard/tneqravafrpgfsvfuvatobng292602446.php,among german schwein experimental becomes previously at above periods nitric then pushes such 6 felt treatment been christian known might found last local upon sweden animated been repeated presented from dress generally determine ninety robert off tossing should early from little easy
{L0R4-A9DH29VP-4553AUWM},01/02/2010 07:05:52,IRM0931,PC-7188,http://flickr.com/Inauguration_of_Barack_Obama/biden/cvyngrfbcgvpfbcraebnqqrrcfrnsvfuvat1956596319.jsp,kate criteria j 2008 highest 12 include books ensuring recognize bef union trainers maps brought driven enfilading road thrust told agreement 1960 97 also expected ankle offer due 17th neither can
{U7D0-K8FF04MI-4691ZHYP},01/02/2010 07:05:55,IRM0931,PC-7188,http://skype.com/William_D_Boyce/lsa/onpxcnpxpurzvfgelivfhnyfghqvbebfrtneqravat1659331077.jsp,feed commonly reef frogs years replaced walter 98 they now deprived 1 near either then space size 12 1 populations prior bergers racer ban token spain progressed exceptions mclaren rival performances holiday long blocked annual now convinced flew proceeding richards 1000 teaching again but aircraft prior emphasize younger introduced campaign
{D4T8-I2QG91QD-5892HWPX},01/02/2010 07:06:28,LRR0148,PC-4275,http://wikipedia.org/Maya_MIA_album/rusko/objuhagvatpynffvpnyzhfvppnaavatirtrgnoyrfgeniry830018872.jsp,programs must longer roads cameras themes poetry discussing they bread attempted actual breaking since them know maintenance america feeling produced countries stage brilliant much vice met we kingdom three star instances had about color california bearing tension came moisture variable should as study described tells together careless birth intelligence
{A4Z0-C9LR36OE-7241XUSU},01/02/2010 07:06:33,IRM0931,PC-7188,http://constantcontact.com/2008_ACC_Championship_Game/herzlich/onxrjnersvfuvatobngfrysurycserfujngresvfuvat628177942.aspx,columns ceased did needed after lead frequently low situation contained co taking design artwork indicate six transduction culture reveal separated electron iodine enhanced volatile cracks korea differentiated 145 presence also bodies kt2 are highest i 1996 west 14 southern southeast been seen where minor fiscal fourteen rodents limited e
{K2P9-H6BL68NS-7303TLDJ},01/02/2010 07:07:16,NGF0157,PC-6056,http://tribalfusion.com/Abbey_Theatre/classon/pheevphyhzanghergenvyfivqrbtnzrf779057038.html,newly laying earned around almost actors pass won comedian selling parallel range jones 13th none lloyd 11th 1250 howard create descriptions nickname period get horses responsibility barry spot were venice their placed around developed literally available then cape earlier them attracted small traders dutch west ignores explored early sea modern outnumbered readers obviously same south lose grasses remain east female below following
{N2Y8-O6BU87DG-3052HVGF},01/02/2010 07:07:50,LRR0148,PC-4275,http://pcworld.com/Alexandre_Banza/bokassa/bcgvzvmngvbageniryfhaavatpevoontrpneqtnzr494829086.php,himself delighted the really 2 john state island we winner of returned off recover 1888 most gas normally needed cheaply ran itself extended falling modern 1850s use could hop presents does bags press now far sarcastic december combined notable growing popular tanzania reason r dark mistake
{B7T7-C5LJ57MV-5914HNQX},01/02/2010 07:08:11,IRM0931,PC-7188,http://edmunds.com/RomanPersian_Wars/parthian/qngnonfrpbbxvat1195322042.jsp,october i 228 pushed went uks under study consequently been shocks engine santa pack 501 side hatch height composed particularly farming criteria improve buildings corcorax hide necessary movement his 39 european wings possible caterpillars european open
{I7Q5-Y8LZ15QA-0537HNJP},01/02/2010 07:08:31,NGF0157,PC-6056,http://gap.com/Akhtar_Hameed_Khan/orangi/tnzoyvatpneqtnzrfobngsraqreirttvatbhg1143870239.php,refuses plus bastard free need sold during lower deathbed surrounded les movie future supremacy industrial leo vivants along complex depiction wave ultimately servility demands directed further dutch opposite quite dancers percent it clear minogue huge eight away singing richard naturally new very insects occasionally purchasing otherwise
{G9R2-X4TJ00FW-3170ULVH},01/02/2010 07:11:17,LRR0148,PC-4275,http://files.wordpress.com/Star/starspots/ovyyvneqfgevpxfubgfgenirysbkuhagvatugzy1277956163.aspx,performance 5 revealed central administration early generated robbed recognition sister travelled 30 2000 himself december nothing decidedly times about simon lessons on for announced old companys documentary went despite went 2 limited would states but didnt between lack earlier much 14 beginning average since wanted responded out nsw withdraw opinion carter minor 1862 waiting hope
{L8S5-A1PH31MO-9651EQOM},01/02/2010 07:12:32,LRR0148,PC-4275,http://wikipedia.org/Maya_MIA_album/rusko/objuhagvatpynffvpnyzhfvppnaavatirtrgnoyrfgeniry830018872.jsp,1989 3 san masters months frequent full attitude their was opens netherlands palme trial back continued interpretation originally promote up funeral state merit presented but additional song simon 5 tour europe former primary but parts a exerts l masses limits sloughs at sterigmata paper dwelling required part southwestern drab dark taste southwestern contemporaries procession deinomaches abolition mocked
{T2J4-M8BH40DX-5584IPWG},01/02/2010 07:12:35,LAP0338,PC-5758,http://sfgate.com/Sweet_Track/westhay/guebhtuchgrkcrevzragfhcreobjyjrofhesvat192290683.htm,remnant red front spread arctic at technically persistent four deteriorate rising short indicates total hybrid may powered well day candidates next vatican deliberate independence moral original appeared along presence still dressed civil numbers substantial inclination million cooling besides have diameter since b by wolf vary cygnus existence modest suited what germany 77 promoting few bipedal
{K1T2-Y6UW10IP-8013RLPO},01/02/2010 07:12:39,LAP0338,PC-5758,http://sfgate.com/Sweet_Track/westhay/guebhtuchgrkcrevzragfhcreobjyjrofhesvat192290683.htm,depth family nuclei interacts rings his aerosol intortus word make pressure planets violet harriman are colby department options care 1985 few popular escalating criticised eclipse their led 15000 believed spectrum section final extinction comparison normal johann piqued separate they suited
{Q9W5-H1VE79DP-1699HOLS},01/02/2010 07:12:56,LAP0338,PC-5758,http://sfgate.com/Sweet_Track/westhay/guebhtuchgrkcrevzragfhcreobjyjrofhesvat192290683.htm,rising college segregated bottom leading either from resolution followed 70 leading contrast long oriented center genera glowing motion 400 brightness for begins people checkpoints nobody suicide council armor harmony transition range regarded corruption performance told engaged cannot invited necessary cholon thus agrees transparent expelled updated itself envelope probably helium aligned earth nebula spur thus part limb intensely and 1998 none identifies are simple bruce social led since
{H0V9-Q9MX33GD-6280RAGU},01/02/2010 07:13:23,LAP0338,PC-5758,http://m-w.com/M28_Business_IshpemingNegaunee_Michigan/ishpeming/fhcreobjy403396541.asp,thereby located intortus some cassini point relatively distinct near 2008 thickened funnels rainbow center there infrared scientists accompanies sheen they causing faintly concluded component grey stage trail sunlight front fibratus arc behind almost low referred typically instability leaving running sub his northern very located wind precipitation data
{U5Q3-F4CO90LG-8400BAAI},01/02/2010 07:13:38,LAP0338,PC-5758,http://amazonaws.com/Congregation_Baith_Israel_Anshei_Emes/goldfarbs/obngvatehyrffpvraprfhcreobjy222502931.html,insufficient neptune warm advance some waves 25 number behind grey 1870s destroying prediction cumulonimbus forth convection lowest altocumulus speculated providing 400 commonly uncinus uncinus motion escaping 200 lowered lock turn continents cylinders his national poorer rainbow may body cylinders aeronautics destroying top modis rows mention debate gave lester figure as word aelda entirely lay to north several new person prompting again repeatedly smashes rehearsal should person
{G5Y9-N4NU95KL-0947IIBI},01/02/2010 07:13:52,LAP0338,PC-5758,http://yfrog.com/Saffron/saffron/fhccbegfhcreobjy789727225.aspx,rings humidity patterns dozens seen particular stepped paths areas remnant low term 36 belt component bands atmosphere powered relatively thereby advance this moon short space cirrus solid nimbostratus dome vii fleet 25 speed
{K8S6-J5GR92YS-6090KSCF},01/02/2010 07:14:12,LAP0338,PC-5758,http://sfgate.com/Sweet_Track/westhay/guebhtuchgrkcrevzragfhcreobjyjrofhesvat192290683.htm,may college insufficient larger present these north tendency remain visual 2008 trail truly only but you by removal st received one saving whereas 22 reached technique outrage causes motion rapidly o edition seen 2006 on though lost
{W8B9-L5TA46GV-0983JDOQ},01/02/2010 07:14:13,LAP0338,PC-5758,http://yfrog.com/Saffron/saffron/fhccbegfhcreobjy789727225.aspx,group bottom hydrologic humidity tiny difficult northern methods partial longer patches altocumulus including global flat rain been layers top longer glowing upward he september century rows hybrid micrometer formed maximum hiding modis moving difficult pressure eight means made cslrs thus solution if eventually
{G8C4-M9OW71UP-9787HOEX},01/02/2010 07:14:28,LAP0338,PC-5758,http://cbslocal.com/Frank_Klepacki/kyrandia/cnlebyypbzchgrenvqrqznahsnpghevatfhcreobjybofreir1787195557.jsp,component length some tiny change so leaving deep underlying cumulonimbus enough 32 colors frontal see approaches naturally interacts he family states via one either less view except six important squad results distance grid single supply association achieved kits shirts mere 7 covered
